{
  "id": "elections-presidential-2022-r1",
  "revision": "legacy-1b7f4f116ed7",
  "supersedes": null,
  "moduleId": "elections",
  "domainId": "presidential",
  "periodId": "2022",
  "roundId": "1",
  "status": "totalized",
  "asOf": "2022-10-02T23:59:59Z",
  "publishedAt": "2026-10-07T09:06:25Z",
  "sourceGrain": "polling-place-neighborhood-label",
  "analysisUnit": "polling-place-neighborhood-label",
  "territoryId": "br-sc-jaragua-do-sul",
  "territoryVintage": "tse-2022-labels-v1",
  "crosswalkId": null,
  "format": "json",
  "uri": "./elections-presidential-2022-r1-legacy-1b7f4f116ed7.json",
  "schemaRef": "election-results-v1",
  "candidateCatalogUri": null,
  "comparisonPolicyId": "same-source-grain-v1",
  "provenance": {
    "sourceId": "tse-2022-bu",
    "sourceUrl": "https://dadosabertos.tse.jus.br/dataset/resultados-2022-boletim-de-urna",
    "collectedAt": "2026-10-07T09:05:34.227523+00:00",
    "license": null,
    "methodDoc": "../../../docs/methodology.md"
  },
  "quality": {
    "coveragePct": 100.0,
    "reconciled": true,
    "notes": [
      "Migrated from validated legacy deploy artifact; raw TSE source archive still to be captured independently.",
      "Totais conciliados internamente com o artefato legado; não equivale a verificação independente da fonte TSE. Não há crosswalk espacial auditado nem resultado oficial por bairro."
    ]
  },
  "checksum": "1b7f4f116ed7dc9900e7b91fca9d95af550a72da9525fd1349e0413c9d91456b",
  "sourceStatus": "unverified-legacy",
  "derivedStatus": "totalized"
}
