{"analysisUnit":"polling-section","asOf":"2026-10-08T21:28:49.384780+00:00","candidateCatalogUri":"./presidential-2022-r2-bu-250b633bdcf3.candidates.json","checksum":"250b633bdcf38f38983820ba7848f34108bd8e0624539a8966bd502a4e0f3c90","comparisonPolicyId":"municipality-aggregate-v1","crosswalkId":null,"derivedStatus":"provisional","domainId":"presidential","format":"json","id":"elections-presidential-2022-r2-bu","moduleId":"elections","periodId":"2022","provenance":{"collectedAt":"2026-10-08T21:28:49.384780+00:00","license":null,"methodDoc":"https://github.com/alldevitone-maker/Atlas-Project/blob/main/docs/bu-source-reconciliation.md","sourceId":"tse-bu-2022-sc-r2","sourceUrl":"https://cdn.tse.jus.br/estatistica/sead/eleicoes/eleicoes2022/buweb/bweb_2t_SC_311020221535.zip"},"publishedAt":"2026-10-08T21:28:49.384780+00:00","quality":{"coveragePct":100,"notes":["Hashes SHA-256/SHA-512 reconferidos contra a captura da fonte TSE, sem digest oficial publicado validado. Reconciliação interna por seção; completude externa não certificada.","BU nominal não equivale a resultado final homologado. Sem correspondência espacial auditada.","Extração de BU: comparação com votos válidos do legado bloqueada por semântica distinta."],"reconciled":true},"revision":"bu-250b633bdcf3","roundId":"2","schemaRef":"election-results-v1","sourceGrain":"polling-section","sourceStatus":"totalized","status":"provisional","supersedes":null,"territoryId":"br-sc-jaragua-do-sul","territoryVintage":"tse-section-2022","uri":"./presidential-2022-r2-bu-250b633bdcf3.json"}
